{
 "episode": "EP001",
 "model": "claude-opus-5-5 first-cut editor (blind; brief+playbook only)",
 "notes": "Pause tightening on floor gaps >=1.2s (laugh-adjacent gaps kept longer); disfluency/repetition cuts keep the last clean restart; no topic-level content cuts; tangents kept and flagged.",
 "ops": [
  {
   "id": "op0001",
   "track": "L",
   "from": "L000000",
   "to": "L000000",
   "category": "disfluency",
   "reason": "开场\"大家好\"前的预备\"好\"",
   "confidence": 0.5,
   "op": "cut"
  },
  {
   "id": "op0002",
   "op": "tighten_pause",
   "track": "both",
   "at": 7.57,
   "target_s": 0.7,
   "category": "pause",
   "reason": "两轨空白 1.57s → 0.7s",
   "confidence": 0.65
  },
  {
   "id": "op0003",
   "op": "tighten_pause",
   "track": "both",
   "at": 19.0,
   "target_s": 0.8,
   "category": "pause",
   "reason": "两轨空白 2.36s → 0.8s",
   "confidence": 0.75
  },
  {
   "id": "op0004",
   "track": "L",
   "from": "L000039",
   "to": "L000041",
   "category": "crosstalk",
   "reason": "\"我们上\"压在P句上且未说完, 删",
   "confidence": 0.5,
   "op": "cut"
  },
  {
   "id": "op0005",
   "track": "P",
   "from": "P000027",
   "to": "P000027",
   "category": "disfluency",
   "reason": "正…正式节目: 删卡顿的第一个\"正\"",
   "confidence": 0.6,
   "op": "cut"
  },
  {
   "id": "op0006",
   "op": "tighten_pause",
   "track": "both",
   "at": 31.12,
   "target_s": 0.7,
   "category": "pause",
   "reason": "两轨空白 1.51s → 0.7s",
   "confidence": 0.65
  },
  {
   "id": "op0007",
   "track": "L",
   "from": "L000069",
   "to": "L000086",
   "category": "content",
   "reason": "\"量大管饱…把这句话剪了吧\" 自嘲梗, 保留但请Leon确认",
   "confidence": 0.4,
   "op": "keep_flag",
   "suggested": "cut"
  },
  {
   "id": "op0008",
   "op": "tighten_pause",
   "track": "both",
   "at": 35.86,
   "target_s": 0.7,
   "category": "pause",
   "reason": "两轨空白 1.92s → 0.7s",
   "confidence": 0.65
  },
  {
   "id": "op0009",
   "track": "L",
   "from": "L000093",
   "to": "L000093",
   "category": "repetition",
   "reason": "听听说 → 听说",
   "confidence": 0.6,
   "op": "cut"
  },
  {
   "id": "op0010",
   "track": "L",
   "from": "L000099",
   "to": "L000102",
   "category": "disfluency",
   "reason": "\"最近刚从 对吧 刚vacation\" 删中间重启",
   "confidence": 0.5,
   "op": "cut"
  },
  {
   "id": "op0011",
   "track": "P",
   "from": "P000042",
   "to": "P000045",
   "category": "repetition",
   "reason": "比较比较比较大 → 比较大",
   "confidence": 0.7,
   "op": "cut"
  },
  {
   "id": "op0012",
   "track": "L",
   "from": "L000107",
   "to": "L000107",
   "category": "crosstalk",
   "reason": "\"五\"孤立残字压在P句上",
   "confidence": 0.45,
   "op": "cut"
  },
  {
   "id": "op0013",
   "track": "L",
   "from": "L000111",
   "to": "L000112",
   "category": "repetition",
   "reason": "军训军训完了 → 军训完了",
   "confidence": 0.5,
   "op": "cut"
  },
  {
   "id": "op0014",
   "op": "tighten_pause",
   "track": "both",
   "at": 53.2,
   "target_s": 0.8,
   "category": "pause",
   "reason": "两轨空白 2.10s → 0.8s",
   "confidence": 0.75
  },
  {
   "id": "op0015",
   "track": "L",
   "from": "L000126",
   "to": "L000127",
   "category": "disfluency",
   "reason": "\"配嗯 配是去了\" 删假起头",
   "confidence": 0.6,
   "op": "cut"
  },
  {
   "id": "op0016",
   "op": "tighten_pause",
   "track": "both",
   "at": 64.81,
   "target_s": 0.7,
   "category": "pause",
   "reason": "两轨空白 1.83s → 0.7s",
   "confidence": 0.65
  },
  {
   "id": "op0017",
   "op": "cut",
   "track": "L",
   "from": 69.3,
   "to": 70.39,
   "category": "single_track_noise",
   "reason": "对方说话时L轨无文字低能量声音(呼吸/杂音) 1.1s",
   "confidence": 0.3
  },
  {
   "id": "op0018",
   "track": "L",
   "from": "L000195",
   "to": "L000195",
   "category": "repetition",
   "reason": "我我觉得 → 我觉得",
   "confidence": 0.6,
   "op": "cut"
  },
  {
   "id": "op0019",
   "track": "P",
   "from": "P000127",
   "to": "P000128",
   "category": "crosstalk",
   "reason": "\"然后\"压在L句上未展开",
   "confidence": 0.45,
   "op": "cut"
  },
  {
   "id": "op0020",
   "op": "tighten_pause",
   "track": "both",
   "at": 97.91,
   "target_s": 0.7,
   "category": "pause",
   "reason": "两轨空白 1.34s → 0.7s",
   "confidence": 0.55
  },
  {
   "id": "op0021",
   "op": "tighten_pause",
   "track": "both",
   "at": 101.44,
   "target_s": 0.8,
   "category": "pause",
   "reason": "两轨空白 2.19s → 0.8s",
   "confidence": 0.75
  },
  {
   "id": "op0022",
   "track": "L",
   "from": "L000239",
   "to": "L000239",
   "category": "repetition",
   "reason": "地地方 → 地方",
   "confidence": 0.6,
   "op": "cut"
  },
  {
   "id": "op0023",
   "track": "L",
   "from": "L000242",
   "to": "L000243",
   "category": "repetition",
   "reason": "就是(停)就是 → 保留第二个",
   "confidence": 0.5,
   "op": "cut"
  },
  {
   "id": "op0024",
   "track": "L",
   "from": "L000249",
   "to": "L000249",
   "category": "repetition",
   "reason": "墨墨西哥 → 墨西哥",
   "confidence": 0.6,
   "op": "cut"
  },
  {
   "id": "op0025",
   "track": "L",
   "from": "L000261",
   "to": "L000262",
   "category": "disfluency",
   "reason": "一躺是那 是那种吗 → 一躺是那种吗",
   "confidence": 0.45,
   "op": "cut"
  },
  {
   "id": "op0026",
   "track": "P",
   "from": "P000231",
   "to": "P000232",
   "category": "disfluency",
   "reason": "在在呃附近 → 在附近",
   "confidence": 0.6,
   "op": "cut"
  },
  {
   "id": "op0027",
   "op": "tighten_pause",
   "track": "both",
   "at": 153.61,
   "target_s": 0.8,
   "category": "pause",
   "reason": "两轨空白 3.96s → 0.8s",
   "confidence": 0.75
  },
  {
   "id": "op0028",
   "track": "P",
   "from": "P000307",
   "to": "P000310",
   "category": "disfluency",
   "reason": "\"你的这个,你第一成\" 删假起头",
   "confidence": 0.45,
   "op": "cut"
  },
  {
   "id": "op0029",
   "track": "L",
   "from": "L000295",
   "to": "L000297",
   "category": "crosstalk",
   "reason": "\"对但是\"压在P\"狼性精神\"上, 后面\"不是 但还好\"重新接上",
   "confidence": 0.45,
   "op": "cut"
  },
  {
   "id": "op0030",
   "op": "tighten_pause",
   "track": "both",
   "at": 170.81,
   "target_s": 0.7,
   "category": "pause",
   "reason": "两轨空白 1.54s → 0.7s",
   "confidence": 0.65
  },
  {
   "id": "op0031",
   "track": "L",
   "from": "L000310",
   "to": "L000316",
   "category": "disfluency",
   "reason": "第一次旅旅就是第一次这个旅途 → 第一次这个旅途",
   "confidence": 0.55,
   "op": "cut"
  },
  {
   "id": "op0032",
   "track": "L",
   "from": "L000333",
   "to": 179.62,
   "category": "disfluency",
   "reason": "\"我挺开(1.65s)我挺开心的\" 删前一次+停顿",
   "confidence": 0.6,
   "op": "cut"
  },
  {
   "id": "op0033",
   "op": "tighten_pause",
   "track": "both",
   "at": 181.51,
   "target_s": 0.7,
   "category": "pause",
   "reason": "两轨空白 1.37s → 0.7s",
   "confidence": 0.55
  },
  {
   "id": "op0034",
   "op": "tighten_pause",
   "track": "both",
   "at": 189.53,
   "target_s": 0.7,
   "category": "pause",
   "reason": "两轨空白 1.29s → 0.7s",
   "confidence": 0.55
  },
  {
   "id": "op0035",
   "op": "tighten_pause",
   "track": "both",
   "at": 192.07,
   "target_s": 0.7,
   "category": "pause",
   "reason": "两轨空白 1.22s → 0.7s",
   "confidence": 0.55
  },
  {
   "id": "op0036",
   "op": "tighten_pause",
   "track": "both",
   "at": 219.81,
   "target_s": 0.7,
   "category": "pause",
   "reason": "两轨空白 1.37s → 0.7s",
   "confidence": 0.55
  },
  {
   "id": "op0037",
   "track": "L",
   "from": "L000520",
   "to": "L000521",
   "category": "repetition",
   "reason": "那个那个 → 那个",
   "confidence": 0.5,
   "op": "cut"
  },
  {
   "id": "op0038",
   "op": "tighten_pause",
   "track": "both",
   "at": 251.86,
   "target_s": 1.2,
   "category": "pause",
   "reason": "含L笑声候选, 只略收 3.14s → 1.2s",
   "confidence": 0.4
  },
  {
   "id": "op0039",
   "track": "L",
   "from": "L000552",
   "to": "L000552",
   "category": "repetition",
   "reason": "继继承 → 继承",
   "confidence": 0.6,
   "op": "cut"
  },
  {
   "id": "op0040",
   "op": "tighten_pause",
   "track": "both",
   "at": 259.76,
   "target_s": 0.7,
   "category": "pause",
   "reason": "两轨空白 1.62s → 0.7s",
   "confidence": 0.65
  },
  {
   "id": "op0041",
   "track": "L",
   "from": "L000581",
   "to": "L000581",
   "category": "repetition",
   "reason": "不不是 → 不是",
   "confidence": 0.6,
   "op": "cut"
  },
  {
   "id": "op0042",
   "track": "L",
   "from": "L000615",
   "to": "L000618",
   "category": "crosstalk",
   "reason": "\"那个当啊\"压在P\"不错啊\"上的假起头",
   "confidence": 0.45,
   "op": "cut"
  },
  {
   "id": "op0043",
   "op": "tighten_pause",
   "track": "both",
   "at": 295.38,
   "target_s": 0.7,
   "category": "pause",
   "reason": "两轨空白 1.60s → 0.7s",
   "confidence": 0.65
  },
  {
   "id": "op0044",
   "track": "L",
   "from": "L000726",
   "to": "L000730",
   "category": "disfluency",
   "reason": "大家就是这个 就是就 school trip → 大家就是 school trip",
   "confidence": 0.4,
   "op": "cut"
  },
  {
   "id": "op0045",
   "op": "tighten_pause",
   "track": "both",
   "at": 305.78,
   "target_s": 0.7,
   "category": "pause",
   "reason": "两轨空白 1.44s → 0.7s",
   "confidence": 0.55
  },
  {
   "id": "op0046",
   "track": "L",
   "from": "L000742",
   "to": "L000749",
   "category": "crosstalk",
   "reason": "\"大家都很累明天到\"被P提问打断且未完, L随后用\"没有\"回答",
   "confidence": 0.5,
   "op": "cut"
  },
  {
   "id": "op0047",
   "op": "tighten_pause",
   "track": "both",
   "at": 321.54,
   "target_s": 0.7,
   "category": "pause",
   "reason": "两轨空白 1.54s → 0.7s",
   "confidence": 0.65
  },
  {
   "id": "op0048",
   "op": "tighten_pause",
   "track": "both",
   "at": 344.0,
   "target_s": 0.7,
   "category": "pause",
   "reason": "两轨空白 1.21s → 0.7s",
   "confidence": 0.55
  },
  {
   "id": "op0049",
   "track": "L",
   "from": "L000934",
   "to": "L000941",
   "category": "crosstalk",
   "reason": "\"就是这样一个节奏\"与P同时开口, 提前到前面的空档里, 两句都保留",
   "confidence": 0.45,
   "op": "slip",
   "delta_s": -1.6
  },
  {
   "id": "op0050",
   "op": "cut",
   "track": "L",
   "from": 355.78,
   "to": 357.19,
   "category": "single_track_noise",
   "reason": "对方说话时L轨无文字低能量声音(呼吸/杂音) 1.4s",
   "confidence": 0.3
  },
  {
   "id": "op0051",
   "track": "L",
   "from": "L000943",
   "to": "L000945",
   "category": "repetition",
   "reason": "就第一天第一天 → 就第一天",